{
  "schema_version": "1.0",
  "run_id": "gh-122",
  "created_at": "2026-08-29T06:00:00Z",
  "updated_at": "2026-08-29T06:30:00Z",
  "pack_version": "3.0.0-alpha.1",
  "producer": {
    "host": "claude-code",
    "adapter_version": "3.0.0-alpha.1"
  },
  "repository": {
    "base_ref": "main",
    "base_sha": "545c0f50ad9d344b07d3a71d5cce61b0fd173697",
    "current_sha": "545c0f50ad9d344b07d3a71d5cce61b0fd173697",
    "provider": "github",
    "remote": "EffortlessMetrics/demo-swarm-swarm"
  },
  "aliases": ["gh-122"]
}
